{
  "$schema": "https://example.org/mappings/dpp/2.0.0/schema",
  "$id": "https://example.org/mappings/dpp/2.0.0",
  "title": "SORT4CIRC DPP JSON XML RDF mapping",
  "mappingVersion": "2.0.0",
  "jsonSchemaVersion": "2.0.0",
  "ontologyVersionIRI": "https://example.org/vocabulary/2.0.0",
  "jsonNamespace": "https://example.org/dpp/2.0.0",
  "xmlNamespace": "https://example.org/dpp/2.0.0",
  "rdfNamespace": "https://example.org/vocabulary/",
  "coverageScope": "all schema-defined exchange fields",
  "rows": [
    {
      "mappingId": "dpp.dppId",
      "mappingVersion": "2.0.0",
      "jsonPath": "dppId",
      "xmlXPath": "/dpp:dpp/dpp:dppId",
      "rdfSubjectType": "s4c:DigitalProductPassport",
      "rdfProperty": null,
      "rdfConstruct": "rdf:subject",
      "datatype": "xsd:anyURI",
      "cardinality": "1",
      "obligation": "mandatory",
      "controlledVocabulary": null,
      "unitRule": null,
      "source": "spec/schemas/dpp-2.0.0.schema.json",
      "semanticMeaning": "Stable passport identifier",
      "notes": "The JSON identifier becomes the RDF resource IRI; the complete value also remains in the reversible rdf:JSON snapshot.",
      "rdfMappingStatus": "subjectIdentifier",
      "rdfMappingReason": null
    },
    {
      "mappingId": "dpp.schemaVersion",
      "mappingVersion": "2.0.0",
      "jsonPath": "schemaVersion",
      "xmlXPath": "/dpp:dpp/dpp:schemaVersion",
      "rdfSubjectType": "s4c:DigitalProductPassport",
      "rdfProperty": "s4c:schemaVersion",
      "rdfConstruct": null,
      "datatype": "xsd:string",
      "cardinality": "1",
      "obligation": "mandatory",
      "controlledVocabulary": null,
      "unitRule": null,
      "source": "spec/schemas/dpp-2.0.0.schema.json",
      "semanticMeaning": "Payload schema release",
      "notes": null,
      "rdfMappingStatus": "direct",
      "rdfMappingReason": null
    },
    {
      "mappingId": "dpp.recordVersion",
      "mappingVersion": "2.0.0",
      "jsonPath": "recordVersion",
      "xmlXPath": "/dpp:dpp/dpp:recordVersion",
      "rdfSubjectType": "s4c:DigitalProductPassport",
      "rdfProperty": "s4c:recordVersion",
      "rdfConstruct": null,
      "datatype": "xsd:integer",
      "cardinality": "1",
      "obligation": "mandatory",
      "controlledVocabulary": null,
      "unitRule": null,
      "source": "spec/schemas/dpp-2.0.0.schema.json",
      "semanticMeaning": "Monotonic record version",
      "notes": null,
      "rdfMappingStatus": "direct",
      "rdfMappingReason": null
    },
    {
      "mappingId": "dpp.status",
      "mappingVersion": "2.0.0",
      "jsonPath": "status",
      "xmlXPath": "/dpp:dpp/dpp:status",
      "rdfSubjectType": "s4c:DigitalProductPassport",
      "rdfProperty": "s4c:passportStatus",
      "rdfConstruct": null,
      "datatype": "xsd:string",
      "cardinality": "1",
      "obligation": "mandatory",
      "controlledVocabulary": "passport-status",
      "unitRule": null,
      "source": "spec/schemas/dpp-2.0.0.schema.json",
      "semanticMeaning": "Passport lifecycle status",
      "notes": "Direct ontology-backed semantic mapping; the canonical rdf:JSON snapshot remains only for lossless reversal.",
      "rdfMappingStatus": "direct",
      "rdfMappingReason": null
    },
    {
      "mappingId": "dpp.supersededBy",
      "mappingVersion": "2.0.0",
      "jsonPath": "supersededBy",
      "xmlXPath": "/dpp:dpp/dpp:supersededBy",
      "rdfSubjectType": "s4c:DigitalProductPassport",
      "rdfProperty": "s4c:supersededBy",
      "rdfConstruct": null,
      "datatype": "xsd:anyURI",
      "cardinality": "0..1",
      "obligation": "optional",
      "controlledVocabulary": null,
      "unitRule": null,
      "source": "spec/schemas/dpp-2.0.0.schema.json",
      "semanticMeaning": "Schema-defined superseded by field at supersededBy.",
      "notes": null,
      "rdfMappingStatus": "direct",
      "rdfMappingReason": null
    },
    {
      "mappingId": "dpp.createdAt",
      "mappingVersion": "2.0.0",
      "jsonPath": "createdAt",
      "xmlXPath": "/dpp:dpp/dpp:createdAt",
      "rdfSubjectType": "s4c:DigitalProductPassport",
      "rdfProperty": "s4c:createdAt",
      "rdfConstruct": null,
      "datatype": "xsd:dateTime",
      "cardinality": "1",
      "obligation": "mandatory",
      "controlledVocabulary": null,
      "unitRule": null,
      "source": "spec/schemas/dpp-2.0.0.schema.json",
      "semanticMeaning": "Creation timestamp with offset",
      "notes": "Direct ontology-backed semantic mapping; the canonical rdf:JSON snapshot remains only for lossless reversal.",
      "rdfMappingStatus": "direct",
      "rdfMappingReason": null
    },
    {
      "mappingId": "dpp.updatedAt",
      "mappingVersion": "2.0.0",
      "jsonPath": "updatedAt",
      "xmlXPath": "/dpp:dpp/dpp:updatedAt",
      "rdfSubjectType": "s4c:DigitalProductPassport",
      "rdfProperty": "s4c:updatedAt",
      "rdfConstruct": null,
      "datatype": "xsd:dateTime",
      "cardinality": "1",
      "obligation": "mandatory",
      "controlledVocabulary": null,
      "unitRule": null,
      "source": "spec/schemas/dpp-2.0.0.schema.json",
      "semanticMeaning": "Last update timestamp with offset",
      "notes": "Direct ontology-backed semantic mapping; the canonical rdf:JSON snapshot remains only for lossless reversal.",
      "rdfMappingStatus": "direct",
      "rdfMappingReason": null
    },
    {
      "mappingId": "dpp.responsibleOperatorId",
      "mappingVersion": "2.0.0",
      "jsonPath": "responsibleOperatorId",
      "xmlXPath": "/dpp:dpp/dpp:responsibleOperatorId",
      "rdfSubjectType": "s4c:DigitalProductPassport",
      "rdfProperty": "s4c:responsibleOperator",
      "rdfConstruct": null,
      "datatype": "xsd:anyURI",
      "cardinality": "1",
      "obligation": "mandatory",
      "controlledVocabulary": null,
      "unitRule": null,
      "source": "spec/schemas/dpp-2.0.0.schema.json",
      "semanticMeaning": "Responsible operator organisation",
      "notes": "Direct ontology-backed semantic mapping; the canonical rdf:JSON snapshot remains only for lossless reversal.",
      "rdfMappingStatus": "direct",
      "rdfMappingReason": null
    },
    {
      "mappingId": "dpp.registryIdentifier",
      "mappingVersion": "2.0.0",
      "jsonPath": "registryIdentifier",
      "xmlXPath": "/dpp:dpp/dpp:registryIdentifier",
      "rdfSubjectType": "s4c:DigitalProductPassport",
      "rdfProperty": "s4c:registryIdentifier",
      "rdfConstruct": null,
      "datatype": "xsd:string",
      "cardinality": "0..1",
      "obligation": "optional",
      "controlledVocabulary": null,
      "unitRule": null,
      "source": "spec/schemas/dpp-2.0.0.schema.json",
      "semanticMeaning": "Schema-defined registry identifier field at registryIdentifier.",
      "notes": "Direct ontology-backed semantic mapping; the canonical rdf:JSON snapshot remains only for lossless reversal.",
      "rdfMappingStatus": "direct",
      "rdfMappingReason": null
    },
    {
      "mappingId": "dpp.accessPolicyVersion",
      "mappingVersion": "2.0.0",
      "jsonPath": "accessPolicyVersion",
      "xmlXPath": "/dpp:dpp/dpp:accessPolicyVersion",
      "rdfSubjectType": "s4c:DigitalProductPassport",
      "rdfProperty": null,
      "rdfConstruct": "rdf:value/rdf:JSON",
      "datatype": "xsd:string",
      "cardinality": "0..1",
      "obligation": "optional",
      "controlledVocabulary": null,
      "unitRule": null,
      "source": "spec/schemas/dpp-2.0.0.schema.json",
      "semanticMeaning": "Schema-defined access policy version field at accessPolicyVersion.",
      "notes": "Preserved only in the canonical rdf:JSON transport snapshot; not counted as semantic RDF coverage.",
      "rdfMappingStatus": "notApplicable",
      "rdfMappingReason": "transport-layer/interface-only: selects an access-control interface profile, not a product semantic fact"
    },
    {
      "mappingId": "dpp.identity",
      "mappingVersion": "2.0.0",
      "jsonPath": "identity",
      "xmlXPath": "/dpp:dpp/dpp:identity",
      "rdfSubjectType": "s4c:TextileEntity",
      "rdfProperty": "s4c:describes",
      "rdfConstruct": null,
      "datatype": "object",
      "cardinality": "1",
      "obligation": "mandatory",
      "controlledVocabulary": null,
      "unitRule": null,
      "source": "spec/schemas/dpp-2.0.0.schema.json",
      "semanticMeaning": "Declared identity block",
      "notes": null,
      "rdfMappingStatus": "direct",
      "rdfMappingReason": null
    },
    {
      "mappingId": "dpp.identity.granularity",
      "mappingVersion": "2.0.0",
      "jsonPath": "identity.granularity",
      "xmlXPath": "/dpp:dpp/dpp:identity/dpp:granularity",
      "rdfSubjectType": "s4c:TextileEntity",
      "rdfProperty": "s4c:granularity",
      "rdfConstruct": null,
      "datatype": "xsd:string",
      "cardinality": "1",
      "obligation": "mandatory",
      "controlledVocabulary": null,
      "unitRule": null,
      "source": "spec/schemas/dpp-2.0.0.schema.json",
      "semanticMeaning": "Model, batch or item granularity",
      "notes": "Direct ontology-backed semantic mapping; the canonical rdf:JSON snapshot remains only for lossless reversal.",
      "rdfMappingStatus": "direct",
      "rdfMappingReason": null
    },
    {
      "mappingId": "dpp.identity.modelId",
      "mappingVersion": "2.0.0",
      "jsonPath": "identity.modelId",
      "xmlXPath": "/dpp:dpp/dpp:identity/dpp:modelId",
      "rdfSubjectType": "s4c:TextileEntity",
      "rdfProperty": "s4c:modelIdentifier",
      "rdfConstruct": null,
      "datatype": "xsd:string",
      "cardinality": "0..1",
      "obligation": "conditional",
      "controlledVocabulary": null,
      "unitRule": null,
      "source": "spec/schemas/dpp-2.0.0.schema.json",
      "semanticMeaning": "Schema-defined model id field at identity.modelId.",
      "notes": "Direct ontology-backed semantic mapping; the canonical rdf:JSON snapshot remains only for lossless reversal.",